{
  "model_tag": "UNIT_TEST",
  "created_at": "2025-09-20T01:02:25.427351",
  "label": "label_R_H3_pct",
  "features": [
    "f_ret_1"
  ],
  "timeframe": null,
  "train_window": {
    "from": "2025-01-01",
    "to": "2025-01-02",
    "rows": 2
  },
  "algo": {
    "name": "ols",
    "params": {
      "lmbd": 0.0
    }
  },
  "artifacts": {
    "pickle_path": null
  },
  "provenance": {
    "dataset_path": "/tmp/pytest-of-jozevec/pytest-31/test_load_dataset_pickle_and_p0/ds.parquet",
    "commit": "2b33455ff0882f307ebc946842250fc6bedaa3da",
    "generator": "scripts/training/train_baseline.py"
  }
}