{
  "model_tag": "BASELINE_LIN_H3",
  "created_at": "2025-09-19T16:45:54.450045",
  "label": "<label>",
  "features": [],
  "timeframe": null,
  "train_window": {
    "from": "",
    "to": "",
    "rows": 0
  },
  "algo": {
    "name": "ridge",
    "params": {
      "alpha": 0.1
    }
  },
  "artifacts": {
    "pickle_path": null
  },
  "provenance": {
    "dataset_path": "<dataset_path>",
    "commit": null,
    "generator": "scripts/registry/init_model_tag.py"
  }
}